{
  "schemaVersion": "mcp-res.reliability-profile-manifest/0.2.0",
  "id": "mcp-res/async-operation/v1",
  "version": "1.0.0",
  "status": "PROVISIONAL",
  "protocolRevisions": ["2026-07-28"],
  "sourceRefs": [
    "https://github.com/modelcontextprotocol/modelcontextprotocol/tree/5f5440bb26a62e2cf3440b92da5a667efa03b267/docs/specification/2026-07-28",
    "https://github.com/modelcontextprotocol/ext-tasks/tree/0d0a6bd4c258b35caa3c810a1dd506cf105b1501/specification/2026-07-28",
    "https://github.com/modelcontextprotocol/modelcontextprotocol/blob/d8fdc88fb970313247d8a180ac1ec3f6a10a8885/docs/development/roadmap.mdx"
  ],
  "requiredChecks": [
    "mrtr-original-call-binding",
    "mrtr-input-request-identity",
    "mrtr-requested-schema",
    "mrtr-bounded-rounds",
    "mrtr-cancellation",
    "mrtr-invalid-response",
    "mrtr-input-privacy",
    "mrtr-resume",
    "mrtr-terminal-result",
    "task-handle-identity",
    "task-state-transitions",
    "task-poll-or-update",
    "task-cancellation",
    "task-duplicate-update",
    "task-late-completion",
    "task-timeout",
    "task-expired-handle",
    "task-wrong-subject-handle",
    "task-restart-persistence-when-claimed",
    "task-cleanup",
    "subscription-filter",
    "subscription-acknowledgment",
    "subscription-identity",
    "subscription-opted-in-only",
    "subscription-ordering-when-defined",
    "subscription-duplicate-notification",
    "subscription-abrupt-stream-loss",
    "subscription-graceful-end",
    "subscription-reconnect-when-claimed",
    "subscription-cleanup",
    "progress-request-scoped",
    "progress-monotonic-when-claimed",
    "progress-not-requested-silence",
    "progress-after-terminal-rejected",
    "progress-bounded-message-size",
    "progress-cancellation-interaction"
  ],
  "conditionalChecks": [],
  "experimentalChecks": [],
  "remotePolicy": "DENY_BY_DEFAULT_REVIEWED_ALLOWLIST_ONLY",
  "compositionBoundary": "MRTR, Tasks, subscriptions, progress, and cancellation retain their own released or extension semantics. This profile records composition assumptions and does not invent a unified MCP lifecycle."
}
